{
  "titre_section": "Ã‰tape 4 â€” MÃ©tadiscernement : observer le filtre qui regarde",
  "sous_titre": "Tu ne regardes plus la scÃ¨neâ€¦ tu regardes celui ou celle qui regarde.",
  "description": "Cette Ã©tape tâ€™invite Ã  quitter la scÃ¨ne observÃ©e pour explorer ton propre regard. Ce que tu as vu, ce que tu as eu envie de croire, ce qui tâ€™a dÃ©rangÃ©â€¦ tout cela parle de toi. Câ€™est une luciditÃ© douce et sans jugement.",
  "objectifs": [
    "ğŸ’¡ RepÃ©rer la lunette qui a dÃ©clenchÃ© une Ã©motion forte ou un inconfort.",
    "ğŸ§­ Identifier les projections personnelles dans ton interprÃ©tation.",
    "ğŸ” DÃ©celer les angles morts que tu as Ã©vitÃ©s.",
    "ğŸª Sentir les rÃ©sonances intimes entre ce que tu observesâ€¦ et ce que tu vis."
  ],
  "questions_reflexives": [
    {
      "champ": "ğŸŒ©ï¸ Lunette marquante",
      "question": "Laquelle des trois lunettes tâ€™a le plus remuÃ©Â·e ? Ã‰tait-ce agrÃ©able, dÃ©rangeant, troublant ? Pourquoi Ã  ton avis ?"
    },
    {
      "champ": "ğŸª¤ Projection personnelle",
      "question": "As-tu projetÃ© un besoin, une peur ou une attente dans lâ€™interprÃ©tation ? Quâ€™espÃ©rais-tu trouver ?"
    },
    {
      "champ": "ğŸ” Angle mort Ã©vitÃ©",
      "question": "Y avait-il une piste que tu as sentiÂ·e venirâ€¦ mais que tu nâ€™as pas voulu suivre ? Pourquoi ?"
    },
    {
      "champ": "ğŸ§¿ RÃ©sonance intime",
      "question": "Est-ce que ce comportement observÃ© te rappelle quelque chose de personnel ? Une tension, une histoire, une contradiction intÃ©rieure ?"
    }
  ],
  "formulation_de_synthese": {
    "proposition": "âœ’ï¸ Pour rÃ©sumer cette introspection, tu peux Ã©crire :",
    "texte": "Â« Je croyais observer un comportement extÃ©rieurâ€¦ mais câ€™Ã©tait mon filtre qui regardait. Â»"
  },
  "note_pedagogique": "Le mÃ©tadiscernement nâ€™est pas une remise en cause culpabilisante. Câ€™est une capacitÃ© douce Ã  voir comment tu fabriques du sens. Câ€™est une luciditÃ© bienveillante qui tâ€™aide Ã  penser plus librement."
}

