{
  "titre_section": "Étape 4 — Métadiscernement : observer le filtre qui regarde",
  "sous_titre": "Tu ne regardes plus la scène… tu regardes celui ou celle qui regarde.",
  "description": "Après avoir traversé les trois lunettes subjectives, cette étape t’invite à inverser le regard. Ce n’est plus le comportement observé que tu analyses, mais ton propre filtre. Ce que tu as vu, ce que tu n’as pas vu, ce que tu as eu envie de croire… tout cela parle aussi de toi.",
  "objectifs": [
    "💡 Repérer les lunettes qui ont éveillé en toi une émotion forte ou un inconfort.",
    "🧭 Identifier ce que tu as projeté dans la scène, consciemment ou non.",
    "🔍 Mettre en lumière les angles morts ou les pistes que tu as évitées.",
    "🪞 Ressentir les résonances intimes entre ce que tu observes… et ce que tu vis."
  ],
  "questions_reflexives": [
    {
      "question": "Comment ressentez-vous cette étape ?"
    }
  ],
  "formulation_de_synthese": {
    "proposition": "✒️ Pour résumer ce retournement intérieur, tu peux écrire :",
    "texte": "« Je croyais observer un comportement extérieur… mais c’était mon filtre qui regardait. »"
  },
  "note_pedagogique": "Le métadiscernement est une forme douce de lucidité. Il ne s’agit pas de te juger, mais d’apprendre à reconnaître comment tu construis du sens. Chaque regard contient déjà une interprétation. Et c’est en regardant le regard… qu’on découvre sa propre subjectivité."
}